{
  "capture_id": "staged_damage_room",
  "tier": "lidar",
  "timestamp": "2026-10-04T04:14:05.582151",
  "units": "meters",
  "rooms": [
    {
      "room_id": "room_staged_damage_room",
      "name": "Kitchen & Suite",
      "ceiling_height_m": {
        "value": 1.183,
        "ci95": 0.15,
        "unit": "m"
      },
      "floor_area_sqm": {
        "value": 1.017,
        "ci95": 0.03,
        "unit": "sqm"
      },
      "polygon_2d_m": [
        [
          -1.051,
          -1.147
        ],
        [
          -0.145,
          -1.147
        ],
        [
          -0.145,
          -0.023
        ],
        [
          -1.051,
          -0.023
        ]
      ],
      "walls": [
        {
          "wall_id": "room_staged_damage_room_W1_South",
          "start_m": [
            -1.051,
            -1.147
          ],
          "end_m": [
            -0.145,
            -1.147
          ],
          "length_m": {
            "value": 0.905,
            "ci95": 0.01,
            "unit": "m"
          },
          "height_m": {
            "value": 1.183,
            "ci95": 0.01,
            "unit": "m"
          },
          "thickness_m": 0.12,
          "openings": [],
          "damage_regions": []
        },
        {
          "wall_id": "room_staged_damage_room_W2_East",
          "start_m": [
            -0.145,
            -1.147
          ],
          "end_m": [
            -0.145,
            -0.023
          ],
          "length_m": {
            "value": 1.124,
            "ci95": 0.01,
            "unit": "m"
          },
          "height_m": {
            "value": 1.183,
            "ci95": 0.01,
            "unit": "m"
          },
          "thickness_m": 0.12,
          "openings": [],
          "damage_regions": [
            {
              "damage_id": "dmg_room_staged_damage_room_W2_East_water_01",
              "damage_class": "water_damage",
              "metric_area_sqm": {
                "value": 0.019,
                "ci95": 0.02,
                "unit": "sqm"
              },
              "bounding_polygon_m": [
                [
                  0.57,
                  0.4
                ],
                [
                  0.71,
                  0.4
                ],
                [
                  0.71,
                  0.54
                ],
                [
                  0.57,
                  0.54
                ]
              ],
              "severity": "medium",
              "confidence": 0.72
            },
            {
              "damage_id": "dmg_room_staged_damage_room_W2_East_crack_01",
              "damage_class": "drywall_crack",
              "metric_area_sqm": {
                "value": 0.001,
                "ci95": 0.01,
                "unit": "sqm"
              },
              "bounding_polygon_m": [
                [
                  0.57,
                  0.9
                ],
                [
                  0.86,
                  1.3
                ]
              ],
              "severity": "medium",
              "confidence": 0.68
            }
          ]
        },
        {
          "wall_id": "room_staged_damage_room_W3_North",
          "start_m": [
            -0.145,
            -0.023
          ],
          "end_m": [
            -1.051,
            -0.023
          ],
          "length_m": {
            "value": 0.905,
            "ci95": 0.01,
            "unit": "m"
          },
          "height_m": {
            "value": 1.183,
            "ci95": 0.01,
            "unit": "m"
          },
          "thickness_m": 0.12,
          "openings": [],
          "damage_regions": []
        },
        {
          "wall_id": "room_staged_damage_room_W4_West",
          "start_m": [
            -1.051,
            -0.023
          ],
          "end_m": [
            -1.051,
            -1.147
          ],
          "length_m": {
            "value": 1.124,
            "ci95": 0.01,
            "unit": "m"
          },
          "height_m": {
            "value": 1.183,
            "ci95": 0.01,
            "unit": "m"
          },
          "thickness_m": 0.12,
          "openings": [],
          "damage_regions": []
        }
      ],
      "concealed_damage_flags": [
        {
          "flag_id": "flag_room_staged_damage_room_W2_East_cd01",
          "surface_id": "room_staged_damage_room_W2_East",
          "rule_id": "RULE-CD-01",
          "rule_name": "Plumbing Wall Cavity Moisture Saturation",
          "rationale": "Detected water damage measuring 0.02 m\u00b2 on plumbing-adjacent partition. Moisture likely penetrated gypsum core into stud cavity, saturating insulation batts and compromising wall framing plate.",
          "risk_level": "high",
          "recommended_investigation": "Thermal imaging probe and non-destructive pinless moisture meter scan across 1.2m radius; invasive cavity inspection cut recommended if moisture >18%."
        }
      ],
      "scope_line_items": [
        {
          "item_id": "scope_room_staged_damage_room_W2_East_01",
          "surface_id": "room_staged_damage_room_W2_East",
          "trade": "Drywall",
          "description": "Cut out damaged gypsum board, hang new 5/8\" sheetrock, tape, mud & sand (1.44 m\u00b2 flood cut)",
          "quantity": 1.44,
          "unit": "sqm",
          "unit_cost_usd": 195.0,
          "total_cost_usd": {
            "value": 280.8,
            "ci95": 22.46,
            "unit": "usd"
          }
        },
        {
          "item_id": "scope_room_staged_damage_room_W2_East_02",
          "surface_id": "room_staged_damage_room_W2_East",
          "trade": "Water Remediation",
          "description": "HEPA vacuum, apply EPA-registered antimicrobial disinfectant spray & wipe",
          "quantity": 1.44,
          "unit": "sqm",
          "unit_cost_usd": 128.0,
          "total_cost_usd": {
            "value": 184.32,
            "ci95": 11.06,
            "unit": "usd"
          }
        },
        {
          "item_id": "scope_room_staged_damage_room_W2_East_03",
          "surface_id": "room_staged_damage_room_W2_East",
          "trade": "Finish Carpentry",
          "description": "Carefully detach 3-1/4\" colonial baseboard, de-nail, prep and reinstall",
          "quantity": 1.2,
          "unit": "linear_m",
          "unit_cost_usd": 22.0,
          "total_cost_usd": {
            "value": 26.4,
            "ci95": 1.32,
            "unit": "usd"
          }
        },
        {
          "item_id": "scope_room_staged_damage_room_W2_East_04",
          "surface_id": "room_staged_damage_room_W2_East",
          "trade": "Drywall",
          "description": "V-groove stress crack, fiberglass mesh tape, 3-coat compound finish",
          "quantity": 0.29,
          "unit": "linear_m",
          "unit_cost_usd": 42.5,
          "total_cost_usd": {
            "value": 12.32,
            "ci95": 0.86,
            "unit": "usd"
          }
        },
        {
          "item_id": "scope_room_staged_damage_room_W2_East_05",
          "surface_id": "room_staged_damage_room_W2_East",
          "trade": "Painting",
          "description": "Stain-blocking primer coat plus two coats low-VOC latex finish paint (full wall finish)",
          "quantity": 1.33,
          "unit": "sqm",
          "unit_cost_usd": 46.0,
          "total_cost_usd": {
            "value": 61.18,
            "ci95": 3.06,
            "unit": "usd"
          }
        }
      ]
    }
  ],
  "stitched_plan": {
    "total_area_sqm": {
      "value": 1.02,
      "ci95": 0.02,
      "unit": "sqm"
    },
    "rooms": [
      {
        "room_id": "room_staged_damage_room",
        "position_m": [
          0.0,
          0.0
        ],
        "rotation_deg": 0.0
      }
    ],
    "adjacencies": [],
    "drift_correction_applied": true,
    "drift_residual_m": 0.021
  },
  "metadata": {
    "pipeline_version": "1.0.0",
    "device_model": "iPhone 15 Pro",
    "runtime_seconds": 1.65,
    "hardware_tier": "LIDAR Pro Sensor Fusion",
    "scale_source": "lidar_depth",
    "scale_quality": "metric"
  }
}